{
  "schema_version": "AGL_LITE_V1_2_1",
  "project_id": "AGL-LITE-EXAMPLE",
  "policy_version": "policy-v1.2.1",
  "created_at_utc": "2026-10-27T00:00:00Z",
  "ack_id": "ACK-001",
  "message_id": "MSG-001",
  "source_event_id": "EV-001",
  "recipient_id": "AGENT_A",
  "stream_id": "STREAM-001",
  "stream_seq": 1,
  "ack_type": "PROCESSED_ACK",
  "operation_id": "OP-002",
  "evidence_ref": "acks/ACK-001.json",
  "idempotency_key": "MSG-001:AGENT_A:PROCESSED_ACK"
}
